{
  "$schema": "../../schemas/v1.7-glaze-studio-v1-2.schema.json",
  "schemaVersion": 1,
  "contractId": "goreecloud.glaze-ui.v1.7.glaze-studio-v1-2",
  "name": "Glaze UI V1.7 Glaze Studio v1.2 Development Contract",
  "version": "1.7.0-dev.33",
  "lifecycle": "Development",
  "stableBaseline": "1.6.0",
  "consumerEligible": false,
  "planVersion": "v1.2",
  "v12SpecificationSections": [40],
  "historicalFoundation": {
    "version": "1.7.0-dev.12",
    "planNumbering": "v1.1-historical-numbering",
    "historicalSpecificationSection": 27,
    "reinterpretedAsV12Section40": false
  },
  "previewDomains": [
    "signature-transitions",
    "motion-profiles",
    "components",
    "adaptive-layout-changes",
    "form-factor-transitions",
    "themes",
    "color-palettes",
    "accessibility-modes",
    "reduced-motion",
    "input-models",
    "semantic-states"
  ],
  "comparisonModes": ["calm", "balanced", "expressive", "reduced-motion"],
  "studioCapabilities": {
    "interactivePreview": true,
    "signatureTransitionPreview": true,
    "motionProfilePreview": true,
    "componentPreview": true,
    "adaptiveLayoutPreview": true,
    "formFactorTransitionPreview": true,
    "themePreview": true,
    "colorPalettePreview": true,
    "accessibilityModePreview": true,
    "reducedMotionPreview": true,
    "inputModelPreview": true,
    "semanticStatePreview": true,
    "sideBySideMotionComparison": true,
    "calmBalancedExpressiveReducedMotionComparison": true,
    "inspectorV12Integration": true,
    "advancedThemeV12Integration": true,
    "motionExpressionIntegration": true,
    "reducedMotionIntegration": true,
    "motionPerformanceIntegration": true,
    "sourceMutationAllowed": false,
    "animationExecutionAllowed": false,
    "themePersistenceAutomatic": false,
    "rankingOrWinnerSelectionAllowed": false
  },
  "authority": {
    "boundary": "development-preview-comparison-only",
    "advisoryOnly": true,
    "sourceModifiedAutomatically": false,
    "animationExecutedByStudio": false,
    "themePersistedAutomatically": false,
    "userPreferenceCreatedByStudio": false,
    "providerTruthCreatedByStudio": false,
    "semanticTruthCreatedByStudio": false,
    "accessibilityStateCreatedByStudio": false,
    "platformCapabilityCreatedByStudio": false,
    "applicationActionsExecutedByStudio": false,
    "navigationExecutedByStudio": false,
    "acceptanceGrantedByStudio": false,
    "lifecyclePromotionAutomatic": false,
    "deploymentAcceptanceAutomatic": false,
    "productionAcceptanceAutomatic": false
  },
  "privacy": {
    "localFirst": true,
    "telemetryRequired": false,
    "networkRequired": false,
    "privateContentRequired": false,
    "rawUserContentCapturedByDefault": false,
    "remoteRuntimeResourcesRequired": false
  },
  "dependencies": {
    "historicalStudio": "1.7.0-dev.12",
    "motionExpressionProfiles": "1.7.0-dev.21",
    "reducedMotionEquivalents": "1.7.0-dev.23",
    "motionPerformance": "1.7.0-dev.25",
    "expandedComponentSystem": "1.7.0-dev.30",
    "advancedThemeSystem": "1.7.0-dev.31",
    "glazeInspector": "1.7.0-dev.32"
  },
  "acceptanceBoundary": {
    "sourceFoundationOnly": true,
    "section40Complete": false,
    "renderedAcceptanceEstablished": false,
    "nativePlatformAcceptanceEstablished": false,
    "assistiveTechnologyAcceptanceEstablished": false,
    "measuredPerformanceAcceptanceEstablished": false,
    "representativeDeviceAcceptanceEstablished": false,
    "energyAcceptanceEstablished": false,
    "humanVisualMotionReviewEstablished": false,
    "downstreamConsumerAcceptanceAutomatic": false,
    "releasePromotionAutomatic": false,
    "deploymentAcceptanceAutomatic": false,
    "productionAcceptanceAutomatic": false
  },
  "runtimeEntrypoint": "js/glaze-v1.7-studio-v1-2.dev.mjs",
  "developmentAggregateEntrypoint": "js/glaze-v1.7-development.mjs",
  "tokenMap": "tokens/glaze-v1.7-studio-v1-2.dev.json",
  "researchRecord": "research/v1.7-glaze-studio-v1-2.md",
  "sourceAuthorities": [
    "GLAZE_UI_V1_7_PLANNED.md",
    "PLANNED-FEATURES.md",
    "IMPLEMENTED-FEATURES.md",
    "CHANGELOGS.md"
  ]
}
